Assesment Name,cleaned_text,Duration,Remote Testing Support,URL,Adaptive/IRT,Job Type
Account Manager Solution,Middle Account Manager solution assessment job candidate apply mid level leadership position tend manage day day operation activity client account sample task job include limit communicate client project status develop maintain project plan coordinate internally appropriate project personnel ensure client expectation meet potential job title use solution Account Executive Account Manager Senior Account Manager multiple configuration solution available,49,yes,https://www.shl.com/solutions/products/product-catalog/view/account-manager-solution/,yes,Middle
Administrative Professional-Short Form,entry Administrative Professional solution entry mid level position involve routine clerical administrative function addition office management function customer service sample task job include limit arrange conference call draft correspondence scheduling meeting greet visitor coordinate office activity potential job title use solution Administrative Assistant Secretary Office Manager Administrative Aide Administrative Associate,36,yes,https://www.shl.com/solutions/products/product-catalog/view/administrative-professional-short-form/,yes,Entry
Agency Manager Solution,Manager Agency Manager solution mid level sale management position include line management sale responsibility sample task job include limit direct coordinate financial activity worker branch office department establishment branch bank brokerage firm risk insurance department credit department potential job title use solution Agency Manager Brokerage Manager multiple configuration solution available,51,yes,https://www.shl.com/solutions/products/product-catalog/view/agency-manager-solution/,yes,Manager
Apprentice + 8.0 Job Focused Assessment,entry Apprentice + Job Focused Assessment short targeted globally applicable assessment include short cognitive ability measure assessment design entry level position appropriate country industry use apprenticeship model intend multi nationally organisation business span region,30,yes,https://www.shl.com/solutions/products/product-catalog/view/apprentice-8-0-job-focused-assessment-4261/,no,Entry
Apprentice 8.0 Job Focused Assessment,entry Apprentice Job Focused Assessment short targeted globally applicable assessment assessment design entry level position appropriate country industry use apprenticeship model intend multi nationally organization business span region,20,yes,https://www.shl.com/solutions/products/product-catalog/view/apprentice-8-0-job-focused-assessment/,no,Entry
Bank Administrative Assistant - Short Form,entry Administrative Assistant solution entry level clerical position interact external internal customer sample task job include limit answer telephone manage file record sort mail greet customer collaborate co worker project potential job title use solution Receptionist Administrative Assistant multiple configuration solution available,35,yes,https://www.shl.com/solutions/products/product-catalog/view/bank-administrative-assistant-short-form/,no,Entry
Bank Collections Agent - Short Form,entry solution entry level collection position inbound outbound center environment financial setting candidate answer multiple choice question measure achievement orientation dependability collector numerical skill revenue recovery customer focus persistence planfulness multiple configuration version solution available,45,yes,https://www.shl.com/solutions/products/product-catalog/view/bank-collections-agent-short-form/,no,Entry
Bank Operations Supervisor - Short Form,Manager Bank Operations Supervisor solution job candidate apply entry level leadership position tend supervise hourly employee sample task job include limit planning prepare work schedule assign employee specific duty coach employee attendance conduct schedule adherence work task develop employee skill train subordinate prioritize multiple task priority make day day decision minimal guidance potential job title use solution Team Leader Line Supervisor Processing Supervisor Center Supervisor Customer Service Supervisor multiple configuration version solution available,45,yes,https://www.shl.com/solutions/products/product-catalog/view/bank-operations-supervisor-short-form/,yes,Manager
Bilingual Spanish Reservation Agent Solution,entry Bilingual Reservation Agent solution design customer center entry level position hospitality industry sample task include make update cancel hotel reservation English spanish listen customer speak spanish enter information computer English provide information hotel service offer potential job title use solution Bilingual Reservation Agent Customer Service Representative Reservationist multiple configuration solution available,43,yes,https://www.shl.com/solutions/products/product-catalog/view/bilingual-spanish-reservation-agent-solution/,yes,Entry
"Bookkeeping, Accounting, Auditing Clerk Short Form",entry Bookkeeping Accounting Auditing Clerk solution entry level position involve enter numerical datum computer system maintain financial record sample task job include limit enter financial datum computer check financial record accuracy perform routine computation financial datum potential job title use solution Accounting Clerk Bookkeeper Accounting Associate Auditing Clerk Accounts Receivable Clerk,49,yes,https://www.shl.com/solutions/products/product-catalog/view/bookkeeping-accounting-auditing-clerk-short-form/,yes,Entry
Branch Manager - Short Form,Manager solution mid upper level financial institution managerial position candidate answer series multiple choice question measure management potential management judgment leadership potential team management branch manager problem solving business leadership leadership motivation interpersonal leadership self leadership branch manager judgment multiple configuration version solution available,50,yes,https://www.shl.com/solutions/products/product-catalog/view/branch-manager-short-form/,no,Manager
Cashier Solution,entry Cashier solution entry level retail position employee receive payment form cash check credit card good purchase sample task job include limit handle payment offer customer service issue receipt refund potential job title use solution Cashier Sales Associate Clerk multiple configuration version solution available,28,yes,https://www.shl.com/solutions/products/product-catalog/view/cashier-solution/,yes,Entry
Claims/Operations Supervisor Solution,Manager Claims Operations Supervisor solution entry level management position involve supervise hourly employee sample task job include limit planning preapre work schedule assign employee specific dutite coach employee attendance conduct schedule adherence work task develop employee skill train subordinate prioritize multiple task priority make day day decision minimal guidance potential job title use solution Team Leader Coach Line Supervisor Claims Supervisor Operations Supervisor Customer Service Supervisor multiple configuration solution available,48,yes,https://www.shl.com/solutions/products/product-catalog/view/claimsoperations-supervisor-solution/,yes,Manager
Contact Center Customer Service + 8.0,entry Contact Center + Customer Service Job Focused Assessment design measure skill competency behavior need success contact center role main focus customer service JFA include mobile optimize contact center simulation behavioral assessment cognitive test assessment capture ability provide exceptional customer service entry level contact center role,41,yes,https://www.shl.com/solutions/products/product-catalog/view/contact-center-customer-service-8-0/,no,Entry
Contact Center Customer Service 8.0,entry Customer Service JFA design entry level position contact center environment main focus customer service,31,yes,https://www.shl.com/solutions/products/product-catalog/view/contact-center-customer-service-8-0-4269/,no,Entry
Contact Center Manager - Short Form,Manager Contact Center Manager solution mid upper level contact center managerial position sample task job include limit supervise coordinate activity subordinate interact day day subordinate train employee potential job title use solution Contact Center Team Leader Line Supervisor Contact Center Manager,50,yes,https://www.shl.com/solutions/products/product-catalog/view/contact-center-manager-short-form/,yes,Manager
Contact Center Sales & Service + 8.0,entry Contact Center + Sales Service Job Focused Assessment design measure skill competency behavior need success contact center role involve sale relate behavior recommend product service retain customer JFA include mobile optimize contact center simulation behavioral assessment cognitive test assessment capture ability provide exceptional customer service drive sale entry level contact center role,41,yes,https://www.shl.com/solutions/products/product-catalog/view/contact-center-sales-and-service-8-0/,no,Entry
Contact Center Sales & Service 8.0,entry Sales Service JFA design contact center role involve sale sale relate behavior recommend product service retain customer,31,yes,https://www.shl.com/solutions/products/product-catalog/view/contact-center-sales-and-service-8-0-4268/,no,Entry
Contact Center Team Lead/Coach - Short Form,Line Manager Professional Individual Contributor Supervisor Contact Center Team Lead Coach solution job candidate apply entry level leadership position tend supervise hourly employee sample task job include limit planning prepare work schedule assign employee specific duty coach employee attendance conduct schedule adherence work task develop employee skill training subordinate tenured peer prioritize multiple task priority make day day decision minimal guidance potential job title use solution Team Leader Coach Line Supervisor Processing Supervisor Center Supervisor Customer Service Supervisor,45,yes,https://www.shl.com/solutions/products/product-catalog/view/contact-center-team-leadcoach-short-form/,yes,"Front Line Manager, Professional Individual Contributor, Supervisor,"
Contact Centre Agent Solution - UK,entry solution job candidate apply entry level position contact centre environment main focus job customer service candidate answer multiple choice question question customer simulation environment solution measure work information customer focus contact centre retention navigation service orientation tactful problem solve addition solution measure datum entry speed accuracy multi tasking preference achievement orientation conscientiousness,39,yes,https://www.shl.com/solutions/products/product-catalog/view/contact-centre-agent-solution-uk/,no,Entry
Customer Service - Short Form,entry Customer Service Representative Solution entry level position involve high degree interaction customer person phone sample task job include limit take order solve product service issue respond positively difficult customer refer unresolved issue appropriate individual provide information product and/or service potential job title use solution Account Service Representative Account Representative Customer Service Representative Customer Service Agent,42,yes,https://www.shl.com/solutions/products/product-catalog/view/customer-service-short-form/,yes,Entry
Customer Service - Short Form - UK,entry Customer Service Representative solution entry level position involve high degree interaction customer person phone sample task job include limit take order solve product service issue respond positively difficult customer refer unresolved issue appropriate individual provide information product and/or service potential job title use solution Account Service Representative Account Representative Customer Service Representative Customer Service Agent,42,yes,https://www.shl.com/solutions/products/product-catalog/view/customer-service-short-form-uk/,yes,Entry
Customer Service with Sales - Short Form,entry Customer Service sale solution entry level position involve provide service support customer sell good service sample task job include limit take order solve product service issue sell product service respond positively difficult customer add new good service exist account provide information product and/or service potential job title use solution Account Service Representative Account Representative Customer Service Representative Sales Representative,44,yes,https://www.shl.com/solutions/products/product-catalog/view/customer-service-with-sales-short-form/,yes,Entry
Director - Short Form,Director Director solution intend use senior level position responsible planning direct coordinate key business activity operation company duty responsibility include formulate policy manage daily operation plan use material human resource potential job title use solution Director Regional Director Director Operations,69,yes,https://www.shl.com/solutions/products/product-catalog/view/director-short-form/,yes,Director
District/Regional Manager Solution,Manager District Regional Manager solution mid- senior level managerial position oversee multiple store define area sample task job include limit direct group supervisor manager have profit loss responsibility district region align work overall company goal potential job title use solution Regional Director District Manager General Manager Regional Manager Store Manager Area Manager multiple configuration version solution available,65,yes,https://www.shl.com/solutions/products/product-catalog/view/districtregional-manager-solution/,yes,Manager
Entry Level Cashier 7.1 (Americas),entry Entry level Cashier solution entry level retail position employee receive payment form cash check credit card good purchase sample task job include limit handle payment offer customer service issue receipt refund potential job title use solution Cashier Sales Associate Clerk,18,yes,https://www.shl.com/solutions/products/product-catalog/view/entry-level-cashier-7-1-%28americas%29/,no,Entry
Entry Level Cashier 7.1 (International),entry Entry level Cashier solution entry level retail position employee receive payment form cash check credit card good purchase sample task job include limit handle payment offer customer service issue receipt refund potential job title use solution Cashier Sales Associate Clerk,18,yes,https://www.shl.com/solutions/products/product-catalog/view/entry-level-cashier-7-1-%28international%29/,no,Entry
Entry Level Customer Service 7.1 (Americas),entry Entry Level Customer Service Solution Retail Contact Center entry level position employee interact customer provide information carry customer request relate organization product service sample task job include limit interact customer phone person take order solve product service issue respond positively difficult irate customer,19,yes,https://www.shl.com/solutions/products/product-catalog/view/entry-level-customer-service-7-1-%28americas%29/,no,Entry
Entry Level Customer Service 7.1 (International),entry Entry Level Customer Service Solution Retail Contact Center entry level position employee interact customer provide information carry customer request relate organization product service sample task job include limit interact customer phone person take order solve product service issue respond positively difficult irate customer,19,yes,https://www.shl.com/solutions/products/product-catalog/view/entry-level-customer-service-%28retail-and-cc%29-7-1/,no,Entry
Entry Level Customer Service 7.1 (South Africa),entry Entry Level Customer Service Solution Retail Contact Center entry level position employee interact customer provide information carry customer request relate organization product service sample task job include limit interact customer phone person take order solve product service issue respond positively difficult irate customer,19,yes,https://www.shl.com/solutions/products/product-catalog/view/entry-level-customer-service-7-1-%28south-africa%29/,no,Entry
Entry level Sales 7.1 (Americas),entry Entry level sale solution entry level position employee proactively sell product service customer compensation and/or performance base sale revenue sample task job include limit promote product customer persuade customer buy product complete transaction customer,20,yes,https://www.shl.com/solutions/products/product-catalog/view/entry-level-sales-7-1-%28americas%29/,no,Entry
Entry level Sales 7.1 (International),entry Entry level sale solution entry level position employee proactively sell product service customer compensation and/or performance base sale revenue sample task job include limit promote product customer persuade customer buy product complete transaction customer,20,yes,https://www.shl.com/solutions/products/product-catalog/view/entry-level-sales-7-1/,no,Entry
Entry Level Sales Sift Out 7.1,entry Entry level sale Sift solution entry level position employee proactively sell product service customer compensation and/or performance base sale revenue sample task job include limit promote product customer persuade customer buy product complete transaction customer,20,yes,https://www.shl.com/solutions/products/product-catalog/view/entry-level-sales-sift-out-7-1/,no,Entry
Event Sales Manager Solution,Manager Event Sales Manager solution design management level position hospitality industry sample task include sell use facility space special event manage staff solution focus sale solve problem make good decision potential job title use solution Event Sales Manager Events Manager Special Events Manager multiple configuration solution available,50,yes,https://www.shl.com/solutions/products/product-catalog/view/event-sales-manager-solution/,yes,Manager
Executive - Short Form,Executive Executive solution intend use senior executive level position responsible planning direct coordinate key business activity operation high level organization executive level accomplish work subordinate executive provide overall direction organization determine formulating policy guideline set board director similar govern body potential job title use solution Executive Vice President President Executive Director,74,yes,https://www.shl.com/solutions/products/product-catalog/view/executive-short-form/,yes,Executive
Financial Professional - Short Form,middle solution mid level financial institution position require Series certification candidate answer multiple choice question measure financial professional aptitude learn potential achievement orientation conscientiousness persistence planfulness self leadership interpersonal leadership sale focus customer focus,35,yes,https://www.shl.com/solutions/products/product-catalog/view/financial-professional-short-form/,no,Middle
Financial Services Representative Solution,Mid Professional Professional Individual Contributor Financial Services Representative solution senior level professional position insurance industry sell life insurance business individual behalf insurance company sample task position include limit call policyholder deliver explain policy suggest addition change calculate premium customize insurance program suite individual customer seek new client develop clientele networking ensure policy requirement fulfil confer client obtain provide information calim policy potential job title use solution Life Insurance Sales Professional Insurance Sales Agent multiple configuration solution available,44,yes,https://www.shl.com/solutions/products/product-catalog/view/financial-services-representative-solution/,no,"Mid-Professional,Professional Individual Contributor"
Front Desk Associate Solution,entry Desk Associate solution design entry level customer service position hospitality industry solution appropriate position majority work guest check desk sample task include welcome guest warmly issue key guest tabulate guest bill accpete payment potential job title use solution Desk Clerk Guest Desk Attendant Guest check Associate Office Agent multiple configuration solution available,50,yes,https://www.shl.com/solutions/products/product-catalog/view/front-desk-associate-solution/,yes,Entry
Gaming Associate Solution,entry Gaming Associate solution design entry mid level position operate gaming table solution highly customer service focus position potentially deal large sum money sample task include deal playing card count confirm patron bet collect patron loss distribute patron winning exchange currency play chip potential job title use solution Table Games Dealer Black Jack Dealer Dealer Casino Dealer Dual Rate Dealer Card Dealer Gaming Dealer multiple configuration solution available,50,yes,https://www.shl.com/solutions/products/product-catalog/view/gaming-associate-solution/,yes,Entry
Gaming Manager Solution,Manager Gaming Manager solution design management level position hospitality industry sample task include manage operation supervisor associate gaming environment solution focus security integrity managing sale potential job title use solution Gaming Floor Manager Gaming Manager multiple configuration solution available,55,yes,https://www.shl.com/solutions/products/product-catalog/view/gaming-manager-solution/,yes,Manager
General Entry Level - All Industries 7.0 Solution,entry General Entry Level Industries solution design entry level position industry solution predict follow type behavior foundational job time work follow rule policy treat respectfully produce quality work meet goal effectively work alongside solution industry entry level position example title include limit Administrator Clerk Veterinary Assistant Stocker Dish Washer Office Coordinator Tour Guide Cook Assistant Housekeeper Waste Collector,19,yes,https://www.shl.com/solutions/products/product-catalog/view/general-entry-level-all-industries-7-0-solution/,no,Entry
General Entry Level - All Industries 7.1 Solution,entry General Entry Level Industries solution design entry level position industry solution predict follow type behavior foundational job time work follow rule policy treat respectfully produce quality work meet goal effectively work alongside solution industry entry level position example title include limit Administrator Clerk Veterinary Assistant Stocker Dish Washer Office Coordinator Tour Guide Cook Assistant Housekeeper Waste Collector,19,yes,https://www.shl.com/solutions/products/product-catalog/view/general-entry-level-all-industries-7-1-solution/,no,Entry
General Entry Level - All Industries 7.1(Americas),entry General Entry Level Industries solution design entry level position industry solution predict follow type behavior foundational job time work follow rule policy treat respectfully produce quality work meet goal effectively work alongside solution industry entry level position example title include limit Administrator Clerk Veterinary Assistant Stocker Dish Washer Office Coordinator Tour Guide Cook Assistant Housekeeper Waste Collector,19,yes,https://www.shl.com/solutions/products/product-catalog/view/general-entry-level-all-industries-7-1%28americas%29/,no,Entry
General Entry Level – Data Entry 7.0 Solution,entry General Entry Level Data Entry solution design entry level position include enter datum computer datum management system solution measure speed accuracy type text number form predict follow type behavior foundational job time work follow rule policy treat respectfully produce quality work meet goal approach work thorough precise manner solution industry entry level position example title include limit Accounting Clerk Accounts Receivable Clerk Administrative Clerk Clerical Aide Clerical Assistant Office Assistant Office Services Specialist Staff Assistant,24,yes,https://www.shl.com/solutions/products/product-catalog/view/general-entry-level-data-entry-7-0-solution/,no,Entry
Graduate + 8.0 Job Focused Assessment,Graduate Graduate + Job Focused Assessment short targeted globally applicable assessment include short cognitive ability measure help identify graduate high potential contribute succeed provide actionable feedback help onboard new hire,30,yes,https://www.shl.com/solutions/products/product-catalog/view/graduate-8-0-job-focused-assessment/,no,Graduate
Graduate 7.1 Job Focused Assessment,Graduate Graduate Job Focused Assessment design professional level position appropriate recent college graduate,19,yes,https://www.shl.com/solutions/products/product-catalog/view/graduate-7-1-job-focused-assessment/,no,Graduate
Guest Service Team 7.0 Solution,entry Guest Service Team solution design team orient entry level position involve high degree interaction customer solution cover wide variety position assess competency critical interact customer include persist meet guest need behave responsibly appropriately effectively work alongside prepare and/or deliver customer order follow rule policy communicate effectively potential job title use solution include Server Hostess Guest Services Team Member Customer Service Champion,18,yes,https://www.shl.com/solutions/products/product-catalog/view/guest-service-team-7-0-solution/,no,Entry
Graduate 8.0 Job Focused Assessment,Graduate Graduate Job Focused Assessment short targeted globally applicable assessment help identify graduate high potential contribute succeed provide actionable feedback help onboard new hire,20,yes,https://www.shl.com/solutions/products/product-catalog/view/graduate-8-0-job-focused-assessment-4228/,no,Graduate
