Assesment Name,cleaned_text,Duration,Remote Testing Support,URL,Adaptive/IRT,Job Type
Guest Services Associate Solution,entry Guest Services Associate solution design entry mid level customer service position hospitality industry solution highly customer service focus position sale component sample task include provide information entertainment dining transportation guest make dining recommentation guest arrange transportation guest make reservation potential job title use solution concierge Guest Services Agent Club Concierge Hotel Concierge Office Manager Guest Services Associate multiple configuration solution available,48,yes,https://www.shl.com/solutions/products/product-catalog/view/guest-services-associate-solution/,yes,Entry
Healthcare Aide 7.0 Solution,entry Healthcare Aide solution design individually orient entry level position directly support person health solution cover wide variety position assess behavior critical patient support role include understanding follow detailed instruction administer personal care respectful tolerant patient prepare maintain record patient progress service perform work hard meet exceed patient need potential job title use solution include Personal Care Aide Healthcare Aide Home Health Aide Dental Assistant,22,yes,https://www.shl.com/solutions/products/product-catalog/view/healthcare-aide-7-0-solution/,no,Entry
Healthcare Call Center Agent Solution,entry Healthcare Center Agent solution entry level position inbound healthcare center environment sample task job include limit take receive information patient phone work computer screen enter information computer potential job title use solution Center Representative Receptionist Switchboard Operator multiple configuration solution available,44,yes,https://www.shl.com/solutions/products/product-catalog/view/healthcare-call-center-agent-solution/,yes,Entry
Healthcare Service Associate Solution,entry Healthcare Service Associate solution entry level position healthcare environment require employee interact patient sample task job include limit deliver food patient clean patient room welcome guest hospital potential job title use solution Housekeepers Dietary Aides Guest Services Coordinator multiple configuration version solution available,37,yes,https://www.shl.com/solutions/products/product-catalog/view/healthcare-service-associate-solution/,yes,Entry
Healthcare Support Specialist Solution,entry Healthcare Support Specialist solution entry level position healthcare environment require employee interact patient sample task job include limit prepare food patient wash hospital linen clean healthcare facility potential job title use solution janitor Food Preparation Workers Laundry Associates multiple configuration solution available,30,yes,https://www.shl.com/solutions/products/product-catalog/view/healthcare-support-specialist-solution/,yes,Entry
Home Health Aide Solution,entry Home Health Aide solution entry level position home group home environment sample task job include limit monitor vital sign medication intake administer bedside personal care ambulation personal hygiene prepare maintain record patient progress service perform potential job title use solution Personal Care Aide Home Health Aide Residential Assistant Certified Nursing Assistant multiple configuration version solution available,41,yes,https://www.shl.com/solutions/products/product-catalog/view/home-health-aide-solution/,yes,Entry
Hospitality Manager Solution,Manager Hospitality Manager solution design management level position hospitality industry sample task include overall property management manage staff manage guest experience solution focus manage business operation manage staff solve problem make good decision maintain focus customer potential job title use solution Property Manager Property Director Hotel Manager Hospitality Manager multiple configuration solution available,57,yes,https://www.shl.com/solutions/products/product-catalog/view/hospitality-manager-solution/,yes,Manager
Host Solution,entry host solution design entry level position hospitality industry sample task include greeting guest manage wait list show guest table solution focus work ethic customer focus potential job title use solution Host Hostess Greeter multiple configuration version solution available,30,yes,https://www.shl.com/solutions/products/product-catalog/view/host-solution/,yes,Entry
Industrial - Entry Level 7.0 Solution,entry Industrial Entry level solution design entry level position measure behavior experience underlie successful safe performance general light industrial role solution cover wide variety entry level position assess behavior include follow policy procedure general facility upkeep produce high quality work maintain orderly work environment wear require protective equipment thorough potential job title use solution include Laborer Custodians Building Grounds Maintenance Workers Handyman,20,yes,https://www.shl.com/solutions/products/product-catalog/view/industrial-entry-level-7-0-solution/,no,Entry
Industrial - Entry Level 7.1 (Americas),entry Industrial Entry level solution design entry level position measure behavior experience underlie successful safe performance general light industrial role solution cover wide variety entry level position assess behavior include follow policy procedure general facility upkeep produce high quality work maintain orderly work environment wear require protective equipment thorough potential job title use solution include Laborer Custodians Building Grounds Maintenance Workers Handyman,20,yes,https://www.shl.com/solutions/products/product-catalog/view/industrial-entry-level-7-1-%28americas%29/,no,Entry
Industrial - Entry Level 7.1 (International),entry Industrial Entry level solution design entry level position measure behavior experience underlie successful safe performance general light industrial role solution cover wide variety entry level position assess behavior include follow policy procedure general facility upkeep produce high quality work maintain orderly work environment wear require protective equipment thorough potential job title use solution include Laborer Custodians Building Grounds Maintenance Workers Handyman,20,yes,https://www.shl.com/solutions/products/product-catalog/view/industrial-entry-level-7-1-%28international%29/,no,Entry
Industrial - Professional and Skilled 7.0 Solution,entry industrial Professional skilled solution design measure behavior experience underlie successful safe performance workplace specialized technical professional industrial role solution assess mechanical comprehension foundational behavior include behave safely efficiently workplace instal repair and/or maintain equipment machinery make sound mechanical decision maintain orderly work environment produce high quality reliable work,49,yes,https://www.shl.com/solutions/products/product-catalog/view/industrial-professional-and-skilled-7-0-solution/,yes,Entry
Industrial - Semi-skilled 7.1 (Americas),entry Industrial semi skilled solution design entry level position measure behavior experience underlie successful safe performance production worker solution assess behavior competency foundational industrial role include follow policy procedure apply relevant trade skill wear require protective equipment work monitor equipment produce high quality work effectively work maintain orderly work environment potential job title use solution include Production Assembly Worker Construction Worker Extraction Technician,24,yes,https://www.shl.com/solutions/products/product-catalog/view/industrial-semi-skilled-7-1-%28americas%29/,no,Entry
Industrial - Semi-skilled 7.1 (International),entry Industrial semi skilled solution design entry level position measure behavior experience underlie successful safe performance production worker solution assess behavior competency foundational industrial role include follow policy procedure apply relevant trade skill wear require protective equipment work monitor equipment produce high quality work effectively work maintain orderly work environment potential job title use solution include Production Assembly Worker Construction Worker Extraction Technician,24,yes,https://www.shl.com/solutions/products/product-catalog/view/industrial-semi-skilled-7-1-%28international%29/,no,Entry
Industrial Professional and Skilled 7.1 (Americas),entry industrial Professional skilled solution design measure behavior experience underlie successful safe performance workplace specialized technical professional industrial role solution assess mechanical comprehension foundational behavior include behave safely efficiently workplace instal repair and/or maintain equipment machinery make sound mechanical decision maintain orderly work environment produce high quality reliable work,49,yes,https://www.shl.com/solutions/products/product-catalog/view/industrial-professional-and-skilled-7-1-%28americas%29/,no,Entry
Industrial Professional and Skilled 7.1 Solution,entry industrial Professional skilled solution design measure behavior experience underlie successful safe performance workplace specialized technical professional industrial role solution assess mechanical comprehension foundational behavior include behave safely efficiently workplace instal repair and/or maintain equipment machinery make sound mechanical decision maintain orderly work environment produce high quality reliable work,49,yes,https://www.shl.com/solutions/products/product-catalog/view/industrial-professional-and-skilled-7-1-solution/,no,Entry
Installation and Repair Technician Solution,Mid Professional Professional Individual Contributor Installation Repair technician solution design use entry level field technician position telecommunications industry solution focus position involve instal repair maintain telecommunications equipment customer interaction little specific sale component sample task include instal repair end user telecommunications equipment service interact customer instal repair telecommunication network infrastructure potential job title use solution Installer Service Technician Customer Installation Technician multiple configuration solution available,49,yes,https://www.shl.com/solutions/products/product-catalog/view/installation-and-repair-technician-solution/,yes,"Mid-Professional,Professional Individual Contributor"
Insurance Account Manager Solution,Middle Insurance Account Manager solution mid level insurance professional manage day day operation activity customer account sample task job include limit solicit sale new additional product service interact customer provide information response inquiry product service handle resolve complaint keep record customer interaction transaction resolve customer service billing complaint determine charge service request collect deposit payment arrange billing potential job title use solution Account Executive Account Manager Senior Account Manager multiple configuration solution available,48,yes,https://www.shl.com/solutions/products/product-catalog/view/insurance-account-manager-solution/,yes,Middle
Insurance Administrative Assistant Solution,entry Administrative Assistant solution entry level clerical position interact external internal customer sample task job include limit answer telephone manage file record sort mail handle information request greet customer collaborate co worker project potential job title use solution Receptionist Administrative Assistant multiple configuration solution available,24,yes,https://www.shl.com/solutions/products/product-catalog/view/insurance-administrative-assistant-solution/,yes,Entry
Insurance Agent Solution,Middle Insurance Agent solution mid level professional position insurance industry sell property casualty automotive type insurance sample task position include limit call policyholder deliver explain policy suggest addition change calculate premium customize insurance program suit individual customer ensure policy requirement fulfil confer client obtain provide information claim policy potential job title use solution Insurance Sales Professional Insurance Sales Agent Producer Insurance Agent multiple configuration solution available,46,yes,https://www.shl.com/solutions/products/product-catalog/view/insurance-agent-solution/,yes,Middle
Insurance Director Solution,Manager Insurance Director solution senior level management position insurance company oversee sale function multiple brokerage office agency geographic territory sample task job include limit direct group sale manager agency manager have profit loss responsibility district region align work overall company goal potential job title use solution Regional Managers Associate Directors Managing Directors multiple configuration solution available,49,yes,https://www.shl.com/solutions/products/product-catalog/view/insurance-director-solution/,yes,Manager
Insurance Sales Manager Solution,Manager Sales Manager solution entry- mid level management position involve supervise employee work insurance organization substantial portion job performance base sale sample task job include limit planning prepare work schedule promote product customer train subordinate analyze sale statistic gather staff determine sale potential monitor preference customer build ongoing customer relationship make day day decision minimal guidance potential job title use solution Insurance Sales Manager Sales Manager Assistant Sales Manager Sales Supervisor multiple configuration solution available,51,yes,https://www.shl.com/solutions/products/product-catalog/view/insurance-sales-manager-solution/,yes,Manager
Manager - Short Form,Manager Manager solution assessment job candidate apply entry level leadership position tend supervise salaried employee sample task job include limit planning project subordinate collaborate senior manager develop new method procedure coach employee performance relate issue develop employee skill coordinate activity manager accomplish organizational goal set meeting department goal prioritize multiple task priority make select strategic day day decision solve employee customer problem potential job title use solution Manager Store Manager Branch Manager,57,yes,https://www.shl.com/solutions/products/product-catalog/view/manager-short-form/,yes,Manager
Manager + 7.0 Solution,Manager Manager + solution design candidate apply entry level leadership position tend supervise salaried employee include SHL new innovative mobile ability assessment Verify Interactive deductive Reasoning sample task job include limit planning project subordinate collaborate senior manager develop new method procedure coach employee performance relate issue develop employee skill coordinate activity manager accomplish organizational goal set meeting department goal prioritize multiple task priority make select strategic day day decision solve employee customer problem,53,yes,https://www.shl.com/solutions/products/product-catalog/view/manager-7-0-solution-3955/,yes,Manager
Manager + 7.1 (Americas),Manager Manager + solution design candidate apply entry level leadership position tend supervise salaried employee include SHL new innovative mobile ability assessment Verify Interactive deductive Reasoning sample task job include limit planning project subordinate collaborate senior manager develop new method procedure coach employee performance relate issue develop employee skill coordinate activity manager accomplish organizational goal set meeting department goal prioritize multiple task priority make select strategic day day decision solve employee customer problem,63,yes,https://www.shl.com/solutions/products/product-catalog/view/manager-7-1-solution-4242/,yes,Manager
Manager + 7.1 (International),Manager Manager + solution design candidate apply entry level leadership position tend supervise salaried employee include SHL new innovative mobile ability assessment Verify Interactive deductive Reasoning sample task job include limit planning project subordinate collaborate senior manager develop new method procedure coach employee performance relate issue develop employee skill coordinate activity manager accomplish organizational goal set meeting department goal prioritize multiple task priority make select strategic day day decision solve employee customer problem,63,yes,https://www.shl.com/solutions/products/product-catalog/view/manager-7-1-%28international%29/,yes,Manager
Manager 7.0 Solution,Manager Manager solution design candidate apply entry level leadership position tend supervise salaried employee sample task job include limit planning project subordinate collaborate senior manager develop new method procedure coach employee performance relate issue develop employee skill coordinate activity manager accomplish organizational goal set meeting department goal prioritize multiple task priority make select strategic day day decision solve employee customer problem,35,yes,https://www.shl.com/solutions/products/product-catalog/view/manager-7-0-solution/,no,Manager
Manager + 7.1 (Americas),Executive Director Line Manager Manager Manager + solution design candidate apply entry level leadership position tend supervise salaried employee include SHL new innovative mobile ability assessment Verify Interactive deductive Reasoning sample task job include limit planning project subordinate collaborate senior manager develop new method procedure coach employee performance relate issue develop employee skill coordinate activity manager accomplish organizational goal set meeting department goal prioritize multiple task priority make select strategic day day decision solve employee customer problem,63,yes,https://www.shl.com/solutions/products/product-catalog/view/manager-7-1-solution-4242/,yes,"Executive, Director, Front Line Manager, Manager"
Manager 7.0 Solution,Manager Manager solution design candidate apply entry level leadership position tend supervise salaried employee sample task job include limit planning project subordinate collaborate senior manager develop new method procedure coach employee performance relate issue develop employee skill coordinate activity manager accomplish organizational goal set meeting department goal prioritize multiple task priority make select strategic day day decision solve employee customer problem,35,yes,https://www.shl.com/solutions/products/product-catalog/view/manager-7-0-solution/,no,Manager
Manager 7.1 (Americas),Executive Director Line Manager Manager Manager solution design candidate apply entry level leadership position tend supervise salaried employee sample task job include limit planning project subordinate collaborate senior manager develop new method procedure coach employee performance relate issue develop employee skill coordinate activity manager accomplish organizational goal set meeting department goal prioritize multiple task priority make select strategic day day decision solve employee customer problem,40,yes ,https://www.shl.com/solutions/products/product-catalog/view/manager-7-1-%28americas%29/,no,"Executive, Director, Front Line Manager, Manager"
Manager 7.1 (International),Executive Director Line Manager Manager Manager solution design candidate apply entry level leadership position tend supervise salaried employee sample task job include limit planning project subordinate collaborate senior manager develop new method procedure coach employee performance relate issue develop employee skill coordinate activity manager accomplish organizational goal set meeting department goal prioritize multiple task priority make select strategic day day decision solve employee customer problem,40,yes,https://www.shl.com/solutions/products/product-catalog/view/manager-7-1-solution/,no,"Executive, Director, Front Line Manager, Manager"
Manager 8.0 JFA,Manager Manager Job Focused Assessment design candidate apply leadership position measure behavior underlie successful performance line manager role wide range industry relevant position supervise salaried employee JFA include Reskilling Potential Scale Management Potential Scale •the reskille potential scale measure tendency learn experience way support professional success •the Management potential scale measure potential managerial success industry type functional area,26,yes,https://www.shl.com/solutions/products/product-catalog/view/manager-8-0-jfa/,no,Manager
Manager 8.0+ JFA,Manager Manager + Job Focused Assessment design candidate apply leadership position include SHL new innovative mobile ability assessment Verify Interactive inductive Reasoning measure behavior underlie successful performance line manager role wide range industry relevant position supervise salaried employee JFA include Reskilling Potential Scale Management Potential Scale •the reskille potential scale measure tendency learn experience way support professional success •the Management potential scale measure potential managerial success industry type functional area,40,yes,https://www.shl.com/solutions/products/product-catalog/view/manager-8-0-jfa-4310/,no,Manager
Manufacturing Production Team Member,entry Manufacturing Production Team Member solution design entry level position measure behavior experience underlie successful safe performance workplace production worker solution measure candidate error check ability general tendency behave safely efficiently workplace solution use variety assessment type include measure personality trait safety relate situational judgment error checking Manufacturing Production Team Member solution design selection job title Production Worker Material Handler Driver Forklift Operator Crewman Mechanic Receiver,35,yes,https://www.shl.com/solutions/products/product-catalog/view/manufacturing-production-team-member/,no,Entry
Manufacturing Skilled Maintenance Worker,entry Manufacturing Skilled Maintenance solution design entry level position measure behavior experience underlie successful safe performance workplace solution measure candidate mechanical comprehension ability general tendency behave safely efficiently workplace solution use variety assessment type include measure personality trait safety relate situational judgment mechanical comprehension Manufacturing Skilled Maintenance solution design selection job title Industrial Machinery Mechanic Automotive Service Technician Small Engine Mechanic Mobile Equipment Service Technician Diesel Service Technician,45,yes,https://www.shl.com/solutions/products/product-catalog/view/manufacturing-skilled-maintenance-worker/,no,Entry
Network Engineer/Analyst Solution,Mid Professional Professional Individual Contributor Network Engineer Analyst solution design use professional level telecommunications engineer network analyst solution focus position involve design monitoring complex telecommunications network place emphasis reasoning ability attention detail multitaske sample task include design network network element ensure proper network operation performance monitoring troubleshoot electronic datum communication network potential job title use solution Network Engineer Network Analyst Communications Engineer multiple configuration solution available,41,yes,https://www.shl.com/solutions/products/product-catalog/view/network-engineeranalyst-solution/,yes,"Mid-Professional, Professional Individual Contributor"
Nurse Leader Solution,Executive Director Line Manager Manager Nurse Leader solution assessment job candidate apply entry level nurse leadership position tend supervise hourly employee sample task job include limit planning prepare work schedule assign nurse specific duty coach nurse attendance conduct schedule adherence work relate task develop nurse skill train subordinate prioritize multiple task priority make day day decision minimal guidance healthcare setting potential job title use solution Nurse Leader Nurse Manager multiple configuration version solution available,59,yes,https://www.shl.com/solutions/products/product-catalog/view/nurse-leader-solution/,yes,"Executive, Director, Front Line Manager, Manager"
Nurse Solution,Mid Professional Professional Individual Contributor Nurse solution professional level healthcare nursing position require licensing registration sample task job include limit assess health condition patient document patient medical information create nursing care plan educate patient healthcare issue potential job title use solution Registered Nurse Charge Nurse Licensed Practical Nurse Clinic Nurse multiple configuration solution available,66,yes,https://www.shl.com/solutions/products/product-catalog/view/nurse-solution/,yes,"Mid-Professional, Professional Individual Contributor"
Nursing Assistant Solution,entry Nursing Assistant solution entry level position clinic hospital environment sample task job include limit turn position bedridden patient feed patient feed observe patient condition include measure record food intake potential job title use solution certify Nursing Assistant Nursing Aide Patient Care Technician Hospital Attendant multiple configuration solution available,41,yes,https://www.shl.com/solutions/products/product-catalog/view/nursing-assistant-solution/,no,Entry
Personal Banker - Short Form,entry Personal Banker Loan Officer solution entry mid level financial institution position sample task job include limit acquire retain expand new exist customer relationship discover customer need make good recommendation complete sale proactively contact meet customer ask referral,30,yes,https://www.shl.com/solutions/products/product-catalog/view/personal-banker-short-form/,no,Entry
